{
  "schemaVersion": 1,
  "title": "Example Social Post Mentions Junior Team Selection",
  "slug": "example-social-post-mentions-junior-team-selection",
  "summary": "A discovery-only source appears to mention a junior team selection, but the official federation page has not been found yet. This item should remain a candidate until a primary source confirms the announcement.",
  "summaryType": "generated",
  "sourceName": "Example Discovery Source",
  "sourceUrl": "https://example.org/social/junior-team-selection",
  "canonicalUrl": "https://example.org/social/junior-team-selection",
  "language": "en",
  "region": "other",
  "category": "federation",
  "tags": ["junior", "team-selection", "unverified"],
  "confidence": 0.48,
  "qualityFlags": [
    "missing_author",
    "missing_published_at",
    "discovery_only_source",
    "primary_source_missing",
    "low_confidence",
    "summary_needs_review"
  ],
  "evidenceRefs": [
    {
      "refId": "ev-002",
      "path": "runs/2026-07-03/1815-example-discovery/evidence-001.md",
      "sourceUrl": "https://example.org/social/junior-team-selection",
      "canonicalUrl": "https://example.org/social/junior-team-selection",
      "capturedAt": "2026-07-03T16:15:00Z",
      "excerpt": "Example social post mentions a junior team selection.",
      "notes": "Needs primary source verification before approval."
    }
  ],
  "dedupeKey": "unknown|example-social-post-mentions-junior-team-selection",
  "lastCheckedAt": "2026-07-03T16:15:00Z"
}

